{
  "artifactSha256": "7e838757727e90b11029d85966525a621f629e5f400fa113abc6168790878b71",
  "manifestSha256": "3d1f9747cefab855725d105f584e938a27bc93baf488598b746418978547595a",
  "releaseActivated": false,
  "releaseArtifact": "/opt/cloudx/releases/0.1.15/cloudx-cloud.pyz",
  "releaseRefCommit": "332cb865a97d654efca4b4321b90cdc140e57e64",
  "releaseVersion": "0.1.15",
  "schema": "cloudx.legacy-health-bridge-artifact-stage.v1",
  "selectorsAfter": {
    "currentArtifactSha256": "aaaaaaaaaaaaaaaaaaaaaaaaaaaaaaaaaaaaaaaaaaaaaaaaaaaaaaaaaaaaaaaa",
    "currentVersion": "0.1.21",
    "previousVersion": "0.1.20"
  },
  "selectorsBefore": {
    "currentArtifactSha256": "aaaaaaaaaaaaaaaaaaaaaaaaaaaaaaaaaaaaaaaaaaaaaaaaaaaaaaaaaaaaaaaa",
    "currentVersion": "0.1.21",
    "previousVersion": "0.1.20"
  },
  "serviceRestarted": false,
  "sourceCommit": "9ffa3208f39053c2b3af1136a530ce98eac7ad41",
  "status": "staged"
}
